{"schemaVersion":"1.0.0","id":"tonegawa:dataset:eastward-pilot","title":{"ja":"利根川東遷パイロットデータ"},"description":{"ja":"利根川東遷に関する1590年・1594年・1654年の資料スナップショットを、出典と不確実性付きで示す小規模な公開データです。形状は概略復元です。"},"defaultLanguage":"ja","bbox":[139.55,35.75,140.65,36.25],"temporalExtent":{"start":{"earliestYear":1590,"latestYear":1590,"precision":"year","qualifier":"exact"},"end":{"earliestYear":1654,"latestYear":1654,"precision":"year","qualifier":"exact"}},"rights":{"status":"open-license","attribution":"Chronomap（概略復元）、国土交通省・埼玉県（引用メタデータ）","terms":"個別Sourceの権利条件、出典表示、編集・加工表示を併せて適用します。"},"files":{"entities":"entities.json","sources":"sources.json","evidence":"evidence.json","featureVersions":"feature-versions.geojson"}}
