{
  "schemaVersion": "1.0.0",
  "id": "gsi-history:dataset:raster-layers",
  "title": {
    "ja": "地理院の歴史系地図・空中写真"
  },
  "description": {
    "ja": "明治期の低湿地、治水地形分類図、1945〜1950年と1961〜1969年の空中写真など、国土地理院が公開する歴史を読むための背景タイルです。"
  },
  "defaultLanguage": "ja",
  "bbox": [
    122.0,
    20.0,
    154.0,
    46.0
  ],
  "temporalExtent": {
    "start": {
      "earliestYear": 1880,
      "latestYear": 1889,
      "precision": "decade",
      "qualifier": "circa"
    },
    "end": {
      "earliestYear": 1961,
      "latestYear": 1969,
      "precision": "decade",
      "qualifier": "circa"
    }
  },
  "rights": {
    "status": "open-license",
    "attribution": "国土地理院",
    "terms": "国土地理院コンテンツ利用規約（出典の明示により利用可）"
  },
  "historicalMapAssets": [
    {
      "id": "swale",
      "title": {
        "ja": "明治期の低湿地"
      },
      "description": {
        "ja": "明治期の地形図から、当時の湿地・水部・荒地などの低湿地を抽出した地図。現在の市街地の下にある旧湖沼・湿地を読める。"
      },
      "bbox": [
        122.0,
        20.0,
        154.0,
        46.0
      ],
      "date": "1880年代〜1910年代",
      "accessedDate": "2026-10-12",
      "georeference": {
        "method": "国土地理院が地理院タイルとして公開した位置合わせ済みタイル",
        "error": "地理院タイルの公開仕様による。原図・撮影の位置誤差を含む"
      },
      "sourceUrl": "https://maps.gsi.go.jp/development/ichiran.html",
      "attribution": "国土地理院",
      "rights": {
        "status": "open-license",
        "attribution": "国土地理院",
        "terms": "国土地理院コンテンツ利用規約（出典の明示により利用可）"
      },
      "tileTemplate": "https://cyberjapandata.gsi.go.jp/xyz/swale/{z}/{x}/{y}.png",
      "minZoom": 5,
      "maxZoom": 16
    },
    {
      "id": "lcmfc2",
      "title": {
        "ja": "治水地形分類図（更新版）"
      },
      "description": {
        "ja": "旧河道・旧水部・自然堤防・後背湿地などの地形分類。過去の流路や湖沼の痕跡を読める。"
      },
      "bbox": [
        122.0,
        20.0,
        154.0,
        46.0
      ],
      "date": "2007年以降更新（地形は過去の痕跡）",
      "accessedDate": "2026-10-12",
      "georeference": {
        "method": "国土地理院が地理院タイルとして公開した位置合わせ済みタイル",
        "error": "地理院タイルの公開仕様による。原図・撮影の位置誤差を含む"
      },
      "sourceUrl": "https://maps.gsi.go.jp/development/ichiran.html",
      "attribution": "国土地理院",
      "rights": {
        "status": "open-license",
        "attribution": "国土地理院",
        "terms": "国土地理院コンテンツ利用規約（出典の明示により利用可）"
      },
      "tileTemplate": "https://cyberjapandata.gsi.go.jp/xyz/lcmfc2/{z}/{x}/{y}.png",
      "minZoom": 5,
      "maxZoom": 16
    },
    {
      "id": "ort_USA10",
      "title": {
        "ja": "空中写真（1945〜1950年）"
      },
      "description": {
        "ja": "米軍が撮影した空中写真。干拓・埋立前の水域や土地利用を確認できる。"
      },
      "bbox": [
        122.0,
        20.0,
        154.0,
        46.0
      ],
      "date": "1945〜1950年",
      "accessedDate": "2026-10-12",
      "georeference": {
        "method": "国土地理院が地理院タイルとして公開した位置合わせ済みタイル",
        "error": "地理院タイルの公開仕様による。原図・撮影の位置誤差を含む"
      },
      "sourceUrl": "https://maps.gsi.go.jp/development/ichiran.html",
      "attribution": "国土地理院",
      "rights": {
        "status": "open-license",
        "attribution": "国土地理院",
        "terms": "国土地理院コンテンツ利用規約（出典の明示により利用可）"
      },
      "tileTemplate": "https://cyberjapandata.gsi.go.jp/xyz/ort_USA10/{z}/{x}/{y}.png",
      "minZoom": 10,
      "maxZoom": 17
    },
    {
      "id": "ort_old10",
      "title": {
        "ja": "空中写真（1961〜1969年）"
      },
      "description": {
        "ja": "高度経済成長期の空中写真。"
      },
      "bbox": [
        122.0,
        20.0,
        154.0,
        46.0
      ],
      "date": "1961〜1969年",
      "accessedDate": "2026-10-12",
      "georeference": {
        "method": "国土地理院が地理院タイルとして公開した位置合わせ済みタイル",
        "error": "地理院タイルの公開仕様による。原図・撮影の位置誤差を含む"
      },
      "sourceUrl": "https://maps.gsi.go.jp/development/ichiran.html",
      "attribution": "国土地理院",
      "rights": {
        "status": "open-license",
        "attribution": "国土地理院",
        "terms": "国土地理院コンテンツ利用規約（出典の明示により利用可）"
      },
      "tileTemplate": "https://cyberjapandata.gsi.go.jp/xyz/ort_old10/{z}/{x}/{y}.png",
      "minZoom": 10,
      "maxZoom": 17
    }
  ],
  "files": {
    "entities": "entities.json",
    "sources": "sources.json",
    "evidence": "evidence.json",
    "featureVersions": "feature-versions.geojson"
  }
}
