{
  "bbox": [
    -10,
    -10,
    10,
    10
  ],
  "defaultLanguage": "en",
  "description": {
    "en": "Non-historical data used only to exercise the contract."
  },
  "files": {
    "entities": "entities.json",
    "evidence": "evidence.json",
    "featureVersions": "feature-versions.geojson",
    "sources": "sources.json"
  },
  "id": "synthetic:dataset:contract-sample",
  "rights": {
    "status": "public-domain"
  },
  "schemaVersion": "1.0.0",
  "temporalExtent": {
    "end": null,
    "start": {
      "earliestYear": -2,
      "latestYear": -2,
      "precision": "year",
      "qualifier": "exact"
    }
  },
  "title": {
    "en": "Synthetic Contract Sample"
  }
}
